{"$schema":"../../Data Format_0.6/Schema_0.6/device_schema_0.6.json","name":"RIG","description":"RIG hardware.","version":0.3,"hardware":{"gsr":{"manufacturer":"Rasberry Pi","model":"Grove GSR sensor (https://thepihut.com/products/grove-gsr-sensor)."},"eeg":{"manufacturer":"Emotiv. See https://emotiv.gitbook.io/cortex-api/ for documentation.","model":"Epoc X","sensors":{"AF3":"AF3 description","F7":"F7 description","F3":"F3 description","FC5":"FC5 description","T7":"T7 description","P7":"P7 description","O1":"O1 description","O2":"O2 description","P8":"P8 description","T8":"T8 description","FC6":"FC6 description","F4":"F4 description","F8":"F8 description","AF4":"AF4 description"}},"microphone":{"manufacturer":"Rasberry Pi","model":"USB microphone"},"camera":{"manufacturer":"Rasberry Pi","model":"ZeroCam"}}}